1277	eng	I have to go to sleep.
1283	eng	"The password is ""Muiriel""."
1284	eng	I will be back soon.
1287	eng	This is never going to end.
1288	eng	I just don't know what to say.
1290	eng	I was in the mountains.
1291	eng	Is it a recent picture?
1292	eng	I don't know if I have the time.
1294	eng	Education in this world disappoints me.
1295	eng	You're in better shape than I am.
1296	eng	You are in my way.
1302	eng	That won't happen.
1305	eng	I can only wonder if this is the same for everyone else.
1308	eng	I miss you.
1309	eng	I'll call them tomorrow when I come back.
1311	eng	You should sleep.
1312	eng	I'm going to go.
1313	eng	I told them to send me another ticket.
1315	eng	I can't live that kind of life.
1316	eng	I once wanted to be an astrophysicist.
1318	eng	The last person I told my idea to thought I was nuts.
1319	eng	If the world weren't in the shape it is now, I could trust anyone.
1326	eng	Are you sure?
1329	eng	Hurry up.
1330	eng	It doesn't surprise me.
1333	eng	It depends on the context.
1335	eng	That's the stupidest thing I've ever said.
1337	eng	When I grow up, I want to be a king.
1344	eng	That was probably what influenced their decision.
1347	eng	It would take forever for me to explain everything.
1353	eng	Let's consider the worst that could happen.
1354	eng	How many close friends do you have?
1355	eng	I may be antisocial, but it doesn't mean I don't talk to people.
1356	eng	This is always the way it has been.
1357	eng	I think it is best not to be impolite.
1359	eng	I'd be unhappy, but I wouldn't kill myself.
1360	eng	Back in high school, I got up at 6 a.m. every morning.
1361	eng	When I woke up, I was sad.
1366	eng	In order to do that, you have to take risks.
1368	eng	Why do you ask?
1372	eng	Whenever I find something I like, it's too expensive.
1373	eng	How long did you stay?
1379	eng	That is intriguing.
1380	eng	You are saying you intentionally hide your good looks?
1383	eng	I didn't know where it came from.
1385	eng	This is not important.
1386	eng	I didn't like it.
1387	eng	She's asking how that's possible.
1390	eng	There's a problem there that you don't see.
1391	eng	You can do it.
1392	eng	My physics teacher doesn't care if I skip classes.
1393	eng	I wish I could go to Japan.
1394	eng	I hate it when there are a lot of people.
1395	eng	I have to go to bed.
1399	eng	Even though he apologized, I'm still furious.
1402	eng	That wasn't my intention.
1403	eng	Thanks for your explanation.
1408	eng	I don't know what you mean.
1414	eng	There are many words that I don't understand.
1419	eng	"I wouldn't have thought I would someday look up ""Viagra"" in Wikipedia."
1420	eng	Can it be phrased in another way?
1421	eng	No one will know.
1423	eng	It seems interesting to me.
1425	eng	I like candlelight.
1426	eng	What did you answer?
1431	eng	Where is the problem?
1433	eng	It's not much of a surprise, is it?
1435	eng	I don't like you anymore.
1438	eng	I don't want to wait that long.
1439	eng	Why don't you come visit us?
1442	eng	I shouldn't have logged off.
1443	eng	I don't know what to do anymore.
1446	eng	I didn't want this to happen.
1449	eng	What other options do I have?
1451	eng	I have nothing better to do.
1452	eng	I can't explain it either.
1454	eng	Seriously though, episode 21 made me almost cry while laughing.
1458	eng	It's not something anyone can do.
1459	eng	I don't know if I still have it.
1460	eng	What do you think I've been doing?
1461	eng	Don't underestimate my power.
1462	eng	My mom doesn't speak English very well.
1464	eng	I was wondering if you were going to show up today.
1467	eng	All you can do is trust one another.
1469	eng	Why are you sorry for something you haven't done?
1473	eng	What keeps you up so late?
1474	eng	You'd be surprised what you can learn in a week.
1475	eng	I don't have anyone who'd travel with me.
1476	eng	You're not fast enough.
1478	eng	Bearing can be unbearable.
1481	eng	Tomorrow, he will land on the moon.
1483	eng	This is a pun.
1484	eng	Nobody understands me.
1485	eng	I learned to live without her.
1487	eng	I have too many things on my mind these days.
1488	eng	I just wanted to check my email.
1496	eng	It would take me too much time to explain to you why it's not going to work.
1499	eng	Are you referring to me?
1501	eng	It can't be!
1504	eng	Would you like something to drink?
1509	eng	We must learn to live together as brothers, or we will perish together as fools.
1513	eng	"""This is what I was looking for!"" he exclaimed."
1514	eng	"""This looks pretty interesting,"" Hiroshi says."
1522	eng	Let me know if there is anything I can do.
1526	eng	I want a boat that will take me far away from here.
1535	eng	If you see a mistake, then please correct it.
1536	eng	Place the deck of cards on the oaken table.
1540	eng	Why don't we go home?
1542	eng	Ten years is a long time to wait.
1544	eng	One million people lost their lives in the war.
1563	eng	Are they all the same?
1566	eng	I'll take him.
1577	eng	Those who live in glass houses should not throw stones.
1578	eng	They say love is blind.
1581	eng	The only useful answers are those that raise new questions.
1597	eng	It's impossible for me to explain it to you.
1601	eng	Imagination affects every aspect of our lives.
1610	eng	Let me know if I need to make any changes.
1612	eng	We can't sleep because of the noise.
1615	eng	Do whatever he tells you.
1617	eng	It took me more than two hours to translate a few pages of English.
1622	eng	What do you want?
1625	eng	I have a bone to pick with you.
1645	eng	I think I'm gonna go to sleep.
1647	eng	I like it very much.
1650	eng	I have to go shopping. I'll be back in an hour.
1651	eng	Is it far from here?
1654	eng	Would you like to dance with me?
1660	eng	I'd like to stay for one night.
1663	eng	Where are the showers?
1664	eng	Open your mouth!
1666	eng	I have lost my wallet.
1674	eng	There are too many things to do!
1679	eng	Thanks to you I've lost my appetite.
1684	eng	If you don't want to put on sunscreen, that's your problem. Just don't come complaining to me when you get a sunburn.
1688	eng	It's so hot that you could cook an egg on the hood of a car.
1698	eng	Look at me when I talk to you!
1700	eng	What if you gave a speech and nobody came?
1703	eng	I was trying to kill time.
1704	eng	How did you come up with this crazy idea?
1709	eng	When do we arrive?
1721	eng	My shoes are too small. I need new ones.
1722	eng	We're getting out of here. The cops are coming.
1736	eng	He would be glad to hear that.
1739	eng	Don't ask what they think. Ask what they do.
1746	eng	Anything that can be misunderstood will be.
1748	eng	Why is life so full of suffering?
1753	eng	I would like to give him a present for his birthday.
1758	eng	I am married and have two children.
1759	eng	He plays the piano very well.
1761	eng	I'd like to study in Paris.
1764	eng	Why do people go to the movies?
1775	eng	Where there's a will, there's a way.
1783	eng	That was the best day of my life.
1803	eng	Take a book and read it.
1817	eng	When you can't do what you want, you do what you can.
1818	eng	Give him an inch and he'll take a yard.
1825	eng	Who am I talking with?
1838	eng	What made you change your mind?
1842	eng	If you know that something unpleasant will happen, that you will go to the dentist for example, or to France, then that is not good.
1850	eng	I'm at the hospital. I got struck by lightning.
1859	eng	I was rereading the letters you sent to me.
1860	eng	I don't want to go to school.
1863	eng	I was planning on going to the beach today, but then it started to rain.
1864	eng	She's really smart, isn't she?
1874	eng	Tomorrow, I'm going to study at the library.
1877	eng	We won the battle.
1880	eng	I watched TV this morning.
1882	eng	I slept a little during lunch break because I was so tired.
1888	eng	Your glasses fell on the floor.
1889	eng	How many times a day do you look at yourself in the mirror?
1890	eng	We went to London last year.
1891	eng	She doesn't want to talk about it.
1897	eng	Close the door when you leave.
1934	eng	The convicted drug dealer was willing to comply with the authorities to have his death sentence reduced to a life sentence.
1959	eng	My roommate is prodigal when it comes to spending money on movies; he buys them the day they're released, regardless of price.
1983	eng	His father would never sanction his engagement to a girl who did not share the same religious beliefs as their family.
2007	eng	I like my job very much.
2008	eng	Ray was willing to corroborate Gary's story, but the police were still unconvinced that either of them were telling the truth.
2011	eng	There was a feeling of constraint in the room; no one dared to tell the king how foolish his decision was.
2037	eng	You had plenty of time.
2042	eng	How many sandwiches are there left?
2043	eng	I'm not inspired anymore.
2045	eng	We could see the sunset from the window.
2049	eng	What happened? There's water all over the apartment.
2053	eng	I am alive even though I am not giving any sign of life.
2063	eng	He told me the story of his life.
2073	eng	When are we eating? I'm hungry!
2083	eng	I learned a lot from you.
2084	eng	We walked a lot.
2085	eng	I spent twelve hours on the train.
2089	eng	He's sleeping like a baby.
2095	eng	She's asking for the impossible.
2096	eng	He disappeared without a trace.
2097	eng	I can place the palms of my hands on the floor without bending my knees.
2105	eng	This place has a mysterious atmosphere.
2106	eng	I look forward to hearing your thoughts on this matter.
2111	eng	She was wearing a black hat.
2112	eng	We made pancakes for breakfast.
2114	eng	I spent the whole afternoon chatting with friends.
2116	eng	Are you just going to stand there all day?
2117	eng	A rabbit has long ears and a short tail.
2121	eng	Your secret will be safe with me.
2122	eng	I don't want to hear any more of your complaining.
2131	eng	I can't wait to go on a vacation.
2139	eng	His story was too ridiculous for anyone to believe.
2161	eng	I want an MP3 player!
2206	eng	I have been told that I am pragmatic, and I am.
2208	eng	I'm running out of ideas.
2209	eng	The seven questions that an engineer has to ask himself are: who, what, when, where, why, how and how much.
2218	eng	Which is your luggage?
2238	eng	Can I pay by credit card?
2241	eng	I feed my cat every morning and every evening.
2249	eng	I need your advice.
2252	eng	Why did you wake me up to tell me something that big? Now, I'll never be able to concentrate on my work!
2264	eng	I am against using death as a punishment. I am also against using it as a reward.
2270	eng	We are haunted by an ideal life, and it is because we have within us the beginning and the possibility for it.
2275	eng	Life is not an exact science, it is an art.
2309	eng	He doesn't look his age.
2319	eng	I don't know him.
2328	eng	Speech is silver, but silence is golden.
2332	eng	I'm not convinced at all.
2342	eng	If you see a man approaching you with the obvious intention of doing you good, you should run for your life.
2357	eng	I don't expect anything from you.
2361	eng	There's no doubt.
2369	eng	Do as you want.
2378	eng	Make yourself at home.
2383	eng	Why aren't you coming with us?
2395	eng	We left by train.
2409	eng	I went to drink a beer with friends.
2412	eng	They quarreled.
2414	eng	He changed a lot since the last time.
2428	eng	They don't even know why.
2443	eng	Those who know him like him.
2445	eng	They are sensible girls.
2453	eng	I don't agree with him.
4909	eng	You are as tall as I am.
4918	eng	You have the same racket as I have.
6024	eng	It happened a long time ago.
6034	eng	It's been snowing all night.
6050	eng	They forgot to lock the door.
6130	eng	She is mad at me.
6136	eng	An eye for an eye, a tooth for a tooth.
8861	eng	You should know better than to ask a lady her age.
9590	eng	You are not at all wrong.
9905	eng	You can rely on him.
10078	eng	You can rely on her.
13335	eng	Did you meet her?
15799	eng	You are selling him short.
15806	eng	You must take his age into account.
15807	eng	Are you for or against his idea?
15808	eng	You must pay attention to his advice.
15813	eng	All that you have to do is to follow his advice.
15817	eng	You must pay attention to him.
15830	eng	You should tell him the truth.
15832	eng	You ought to ask him for advice.
15896	eng	You won't be late, will you?
15915	eng	What do you want to be when you grow up?
15933	eng	You look as healthy as ever.
15956	eng	You seem to be an honest man.
15999	eng	Did you do your homework by yourself?
16083	eng	You must do as I tell you.
16088	eng	I wish you had told me the truth.
16110	eng	Did you call me up last night?
16113	eng	Did you go out last night?
16131	eng	You'd better not go out today.
16132	eng	You must not go out today.
16154	eng	You had better go.
16171	eng	You did an excellent job.
16226	eng	You are as white as a sheet.
16246	eng	Will you stay at home?
16247	eng	You will stay at home.
16251	eng	What time are you going on duty?
16252	eng	What time will you get to the station?
16308	eng	Did you read it at all?
16330	eng	Did you break the window on purpose or by accident?
16392	eng	You had better go to bed now.
16400	eng	Have you done all your homework?
16406	eng	It is time you went to school.
16420	eng	You haven't changed at all.
16433	eng	You'd better go by bus.
16493	eng	How did you come to know her?
16512	eng	You've been had.
16636	eng	You should have told me a long time ago.
16807	eng	I wish you had told me the truth then.
16883	eng	Your driver's license has expired.
17015	eng	I can hear you, but I can't see you.
17033	eng	You have no one but yourself to blame.
17108	eng	What time is it by your watch?
17150	eng	Where do you come from?
17184	eng	I liked your idea and adopted it.
17188	eng	Do as you like.
17277	eng	Leave your desk as it is.
17293	eng	Let's meet halfway between your house and mine.
17397	eng	Your collar has a stain on it.
17401	eng	I took your umbrella by mistake.
17409	eng	Your sister looks as noble as if she were a princess.
17451	eng	I refuse to be treated like a slave by you.
17465	eng	I ordered you to get out.
17521	eng	I can't hide the fact from you.
17694	eng	Don't you move from here.
17701	eng	I had no idea that you were coming.
17739	eng	I don't know whether you like her or not.
17826	eng	We heard the news that you had passed the exam.
17882	eng	You can't be hungry. You've just had dinner.
17886	eng	Be sure to put out the fire before you leave.
17889	eng	She'll have left before you come back.
17898	eng	I can't help but think you're making a mistake.
17944	eng	I'm looking forward to hearing from you.
17948	eng	I didn't expect such a nice present from you.
18084	eng	When bears sleep or lie down, their postures depend on whether they want to get rid of heat or conserve it.
18117	eng	My shoes are worn out.
18127	eng	I met her by accident.
18219	eng	They shook hands when they met at the airport.
18341	eng	The sky has become clear.
18450	eng	Banks will try to lend you an umbrella on a sunny day, but they will turn their backs on a rainy day.
18715	eng	I have not heard from her recently.
18721	eng	I haven't seen anything of her lately.
18743	eng	A fire broke out nearby.
18764	eng	I hope it won't be long before I hear from her.
19007	eng	The professor treated her as one of his students.
19047	eng	Get out of the classroom.
19169	eng	Excuse me, but let me have another look at the photo.
19407	eng	I had an operation for glaucoma last year.
19409	eng	I had a stroke last year.
19478	eng	The milk has gone bad.
19480	eng	The milk has turned sour.
19576	eng	The young man who has not wept is a savage, and the old man who will not laugh is a fool.
19721	eng	I rushed out of my house.
20352	eng	The temperature has suddenly dropped.
20911	eng	The crowd may be on the side of Luciano, but the champ has got the skill to win and that's what matters.
21629	eng	When she returned home from school, she began to help her mother in the kitchen.
21683	eng	She certainly looks beautiful in a Japanese kimono.
26960	eng	It was raining hard, but she insisted on going for a drive.
5409	rus	Давайте что-нибудь попробуем!
5410	rus	Мне пора идти спать.
5411	rus	Что ты делаешь?
5412	rus	Что это?
5419	rus	У меня нет слов.
5421	rus	Не знаю, что и сказать.
5426	rus	Микрофон по какой-то причине до этого не работал.
5430	rus	Нелегко решать, что правильно, а что нет, но приходится это делать.
5431	rus	Это ничего не изменит.
5436	rus	Этого не случится.
5437	rus	Иногда он очень странен.
5438	rus	Я постараюсь не мешать тебе учиться.
5439	rus	Я могу только догадываться, так ли это и для всех остальных.
5440	rus	Я полагаю, это будет выглядеть несколько иначе, когда ты подумаешь об этом в долгосрочном плане.
5441	rus	Не беспокойся.
5442	rus	Я скучаю по тебе.
5443	rus	Я позвоню им завтра, когда вернусь домой.
5444	rus	Мне всегда больше нравились таинственные персонажи.
5445	rus	Тебе лучше поспать.
5447	rus	Я сказал им послать мне ещё один билет.
5448	rus	У тебя не хватает терпения на меня.
5449	rus	Я так жить не могу.
5450	rus	Когда-то я хотел быть астрофизиком.
5451	rus	Я никогда не любил биологию.
5452	rus	Последний человек, которому я рассказал свою идею, решил, что я сумасшедший.
5453	rus	Если бы мир не был таким, каков он сейчас, я мог бы доверять людям.
5454	rus	К сожалению, это правда.
5455	rus	Они слишком заняты склоками друг с другом, чтобы думать об общих идеалах.
5456	rus	Большинство людей думает, что я сумасшедший.
5457	rus	Нет, не я, а ты!
5458	rus	Это мой ответ!
5459	rus	Он меня пинает!
5460	rus	Ты уверен?
5461	rus	Тогда это проблема...
5464	rus	Это не удивительно.
5465	rus	Если бы я мог быть таким...
5466	rus	Почему-то по ночам я бодрее.
5467	rus	Это зависит от контекста.
5468	rus	Ты шутишь?
5469	rus	Это самая глупая вещь, которую я когда-либо говорил.
5471	rus	Когда я вырасту, я хочу стать королём.
5472	rus	Америка - это очень милое место, если вы находитесь здесь с целью заработать деньги.
5474	rus	Так что?
5475	rus	Я пристрелю его.
5478	rus	Скорее всего, это и повлияло на их решение.
5479	rus	Мне всегда было интересно, как это - иметь братьев и сестер.
5480	rus	Я бы так и сказал.
5481	rus	Мне потребуется вечность, чтобы всё объяснить.
5482	rus	Это потому, что ты девушка.
5483	rus	Иногда я не могу сдержать эмоций.
5484	rus	Это и есть то слово, для которого я хотел бы найти замену.
5485	rus	Это было что-то, что я должен был запрограммировать.
5487	rus	Давай подумаем, что может произойти в худшем случае.
5488	rus	Сколько у тебя близких друзей?
5489	rus	Быть может, я и асоциален, но это не значит, что я не общаюсь с людьми.
5490	rus	Так оно и есть.
5493	rus	Быть может, я несчастлив, но я не собираюсь убивать себя.
5494	rus	Когда я учился в средней школе, я вставал в 6:00 каждое утро.
5495	rus	Когда я проснулся, мне было грустно.
5496	rus	Это то, что раскрывается под конец.
5497	rus	Я думал, ты любишь изучать новые вещи.
5499	rus	Если бы я мог послать тебе зефир, Чанг, я сделал бы это.
5500	rus	Ты должен рискнуть, чтобы сделать это.
5501	rus	Каждый одинокий человек одинок из-за страха перед окружающими.
5502	rus	Почему ты спрашиваешь?
5503	rus	Я не художник. Я совсем не гожусь для этого.
5504	rus	Я не могу сказать ей это сейчас. Это уже не так просто.
5505	rus	Я человек с недостатками, но это недостатки, которые могут быть легко устранены.
5506	rus	Всегда, когда я нахожу что-либо, что мне нравится, это слишком дорого.
5507	rus	Сколько ты там пробыл?
5508	rus	Может, для него это будет то же самое.
5511	rus	Я не хочу менять свои взгляды, даже если они несколько экстремальны.
5512	rus	Думаю, у меня есть теория на этот счёт.
5514	rus	Ты хочешь сказать, что намеренно скрываешь свою красоту?
5515	rus	У меня нет учетной записи на этих форумах.
5516	rus	Если кто-либо спросит, в чем суть истории, я действительно не знаю.
5518	rus	Я думаю, наше совместное проживание повлияло на твой стиль жизни.
5520	rus	Мне это не нравилось.
5521	rus	Она спрашивает, как это возможно.
5522	rus	Ты просто убегаешь от жизненных проблем.
5523	rus	Если взглянуть на текст песни, ясно, что он на самом деле ничего не значит.
5524	rus	Есть проблема, которую ты не понимаешь.
5526	rus	Моему учителю физики все равно, пропущу ли я занятия.
5527	rus	Я хотела бы иметь возможность поехать в Японию.
5529	rus	Мне нужно идти спать.
5530	rus	Потом я ушел оттуда, но понял, что забыл сумку.
5531	rus	Я не буду вас сегодня больше ни о чем спрашивать.
5532	rus	На следующей неделе могут быть заморозки.
5533	rus	Несмотря на то, что он извинился, я все ещё в бешенстве.
5535	rus	Спасибо за то, что наконец объяснили, почему люди принимают меня за идиота.
5536	rus	Это не было моим намерением.
5537	rus	Спасибо за объяснение.
5540	rus	Если вы не знали меня с этой стороны, то вы вообще меня не знали.
5541	rus	Я испытываю страх, если не вижу тебя в онлайне в течение всего дня.
5543	rus	Мой компьютер кое на что годится.
5544	rus	Ты хотел мне рассказать о свободе?
5546	rus	Если бы я хотел напугать тебя, я бы рассказал тебе, что мне снилось несколько недель назад.
5547	rus	Нельзя ожидать всего от школы.
5548	rus	Есть много слов, которые я не понимаю.
5549	rus	Я не люблю, когда математики, знающие намного больше меня, не могут ясно выражать свои мысли.
5551	rus	Мне нужно задать тебе глупый вопрос.
5552	rus	Я не знаю, как показать это, поскольку это и так вполне ясно.
5553	rus	"Мне не хотелось бы думать, что однажды мне придется искать слово ""виагра"" в Википедии."
5554	rus	Можно сформулировать это по-другому?
5556	rus	Я нашел решение, но я нашел его настолько быстро, что оно определенно не может быть верным.
5558	rus	За исключением этого места, все не так просто.
5561	rus	Нет, это не мой новый бойфренд.
5563	rus	У тебя вообще не бывает занятий или что?
5564	rus	Тогда я поразгадываю судоку, вместо того чтобы беспокоить тебя.
5565	rus	В чем проблема?
5566	rus	Я могу только ждать.
5567	rus	Это совсем не удивительно, не так ли?
5568	rus	Я люблю тебя!
5569	rus	Ты мне больше не нравишься.
5572	rus	Я не хочу ждать так долго.
5574	rus	Но вероятность невелика.
5577	rus	Когда-нибудь я обязательно поеду во Францию, просто пока не знаю когда.
5579	rus	Я не хотел, чтобы это случилось.
5581	rus	Какие у меня есть еще варианты?
