289	deu	Mir gehen in diesen Tagen zu viele Dinge durch den Kopf.
292	deu	Du kannst nicht von mir erwarten, dass ich immer an alles denke!
293	deu	Ich vermute, dass es hinter jeder Sache, die wir tun müssen, etwas gibt, das wir tun wollen...
294	deu	Du hast wirklich nicht die richtigen Prioritäten!
296	deu	Du hast nie Zeit für die wichtigen Dinge!
297	deu	Das ist die Mühe nicht wert, so zu tun, als würdest du mich dazu bringen, zu glauben, dass ich Dinge glaube, die du nicht glaubst.
298	deu	Das würde zu lange dauern, dir zu erklären, warum das nicht funktionieren wird.
299	deu	Ich bin so blöd... ich versuche, dir Dinge zu erklären, die ich selbst nicht verstehe.
300	deu	"Hör auf, mich als einen ""normalen"" Menschen anzusehen!"
301	deu	Du könntest zumindest versuchen, ein bisschen höflicher zu sein, auch wenn das nicht in deiner Natur liegt.
304	deu	Ich wünschte, ich könnte mir mehr aus Noten machen, aber scheinbar habe ich an einem gewissen Punkt in meinem Leben entschieden, dass es nicht mehr so wichtig sei.
305	deu	"""Wer rastet, der rostet"" ist ein Sprichwort."
313	deu	Öh, wie funktioniert das?
314	deu	"""Um die Wahrheit zu sagen, ich habe Höhenangst."" ""Du bist ein Angsthase!"""
315	deu	"""Vertraue mir"", sagte er."
316	deu	"""Danach habe ich gesucht"", erklärte er."
317	deu	"""Das sieht ziemlich interessant aus"", sagt Hiroshi."
318	deu	Ihre Kommunikation ist vielleicht viel komplexer als wir dachten.
320	deu	"""Das ist sehr nett von Ihnen"", antwortete Willie."
321	deu	"""Danke für die Hilfe."" ""Keine Ursache."""
322	deu	Irgendwann werde ich wie der Wind rennen.
323	deu	"""Sie mag Musik."" ""Ich auch."""
325	deu	Lass es mich wissen, wenn es irgendetwas gibt, was ich tun kann.
327	deu	Du entscheidest, ob wir dahin gehen oder nicht.
328	deu	Das fängt nicht vor acht Uhr dreißig an.
329	deu	Ich wünsche mir ein Boot, das mich weit weg von hier bringt.
331	deu	"""Sind wir uns nicht schon einmal begegnet?"", fragte der Student."
334	deu	Der Bogenschütze tötete den Hirsch.
336	deu	Der Roggen wurde Arme-Leute-Getreide genannt.
337	deu	In den 1950ern sagte man den Finnen nach, eine der ungesündesten Ernährungsweisen der Welt zu haben.
338	deu	Wenn du einen Fehler siehst, dann korrigiere ihn bitte.
339	deu	Lege das Kartenspiel auf den Eichentisch.
341	deu	Wenn man nicht isst, stirbt man.
342	deu	"Wie schreibt man ""pretty""?"
343	deu	Wieso gehen wir nicht heim?
344	deu	Es tut mir leid, ich kann nicht lange bleiben.
345	deu	10 Jahre sind eine lange Zeit zum Warten.
347	deu	Eine Million Menschen haben im Krieg ihr Leben verloren.
348	deu	Ich kam vor drei Jahren nach Tokyo und seither habe ich hier gelebt.
349	deu	Ich habe mehr als einen Monat lang in Nagoya gelebt.
350	deu	Es ist überhaupt nicht selten, länger als neunzig Jahre zu leben.
354	deu	Demokratie ist die schlechteste Regierungsform, abgesehen von allen anderen, die ausprobiert wurden.
355	deu	Wenn man beginnt, seinem Passfoto ähnlich zu sehen, sollte man in den Urlaub fahren.
356	deu	Ich war's nicht, Kommissar!
360	deu	Und niemand hat Ihnen geholfen?
361	deu	Du bist ein Engel!
364	deu	Du hast Glück gehabt, dass er dich nicht gebissen hat.
365	deu	Hast du mich vermisst?
367	deu	Sind sie alle gleich?
369	deu	Wo sind bitte die Eier?
372	deu	Das ist eine gute Idee!
373	deu	Hin- und Rückfahrt? Nur Hinfahrt.
374	deu	Es ist schade, wenn jemand stirbt.
377	deu	Nach der Wäsche in Form bringen.
378	deu	Vor dem Tragen waschen.
381	deu	Wer im Glashaus sitzt, sollte nicht mit Steinen werfen.
382	deu	Man sagt, Liebe mache blind.
383	deu	Oh, tut mir leid.
387	deu	Arm ist nicht, wer zu wenig besitzt, sondern, wer zu viel haben möchte.
388	deu	Da du nicht überrascht bist, denke ich, musst du es gewusst haben.
389	deu	Wie lange braucht man bis zum Bahnhof?
391	deu	Entschuldigung, erlauben Sie mir, auf drei Fehler in dem obigen Artikel hinzuweisen.
396	deu	"Man sagt, dass ""Hamlet"" das interessanteste Stück sei, das je geschrieben wurde."
399	deu	"""Wie fühlst du dich?"", fragte er."
400	deu	Es ist ziemlich schwierig, Französisch nach 2, 3 Jahren zu beherrschen.
401	deu	Es ist mir unmöglich, es dir zu erklären.
402	deu	Ich möchte nicht mein restliches Leben damit verbringen, es zu bereuen.
403	deu	Es wäre lustig zu sehen, wie die Dinge sich im Lauf der Jahre ändern.
405	deu	Die Fantasie hat Auswirkungen auf alle Aspekte in unserem Leben.
408	deu	Ich frage mich, wie lange es dauern wird.
411	deu	Ohne Anstrengung erreicht man nichts.
413	deu	Ein Leben ohne Liebe hat überhaupt keinen Sinn.
414	deu	Lasst es mich wissen, wenn ich irgendwelche Änderungen machen muss.
416	deu	Wir können wegen des Lärms nicht schlafen.
419	deu	Tu, was auch immer er dir befiehlt.
421	deu	Ich habe über zwei Stunden gebraucht, um einige Seiten Englisch zu übersetzen.
429	deu	Ich habe ein Hühnchen mit dir zu rupfen.
434	deu	Ich habe einen Traum.
435	deu	Das ist meine Freundin Rachel, wir sind zusammen ins Gymnasium gegangen.
436	deu	Die Lebenshaltungskosten sind drastisch gestiegen.
438	deu	Überrascht sein, sich wundern, heißt anfangen, zu verstehen.
440	deu	Zur Vollkommenheit fehlte ihr nur ein Fehler.
442	deu	Wir sehen die Dinge nicht, wie sie sind, sondern wie wir sind.
444	deu	Kein Schüler beschwert sich je, Schmerzen im Frontallappen der linken Gehirnhälfte zu haben.
446	deu	Du hast mich gefunden, wo sonst niemand gesucht hat.
447	deu	Du bist an meiner Seite, jetzt ist alles gut.
449	deu	Du siehst dumm aus.
453	deu	Es gefällt mir sehr gut.
454	deu	Sehen wir uns morgen?
455	deu	Wie heißt das auf Italienisch?
457	deu	Das sind nicht meine Sachen!
459	deu	Tanzt du mit mir?
464	deu	Es ist nicht meine Schuld!
465	deu	Ich möchte eine Nacht bleiben.
466	deu	Könnten Sie für mich wählen? Das Telefon hängt zu hoch.
467	deu	Gibt es hier in der Nähe eine Jugendherberge?
469	deu	Öffnen Sie den Mund!
472	deu	Ich bin einverstanden.
476	deu	Er ist sehr sexy.
481	deu	Los, spiel' mit mir, mir ist so langweilig!
483	deu	Hör auf, mich um ein Getränk zu bitten! Geh, hol dir selbst eins.
486	deu	Das ist so lange her, dass ich mit meiner Familie ins Disneyland gegangen bin.
492	deu	Es ist so heiß, dass man Eier auf den Motorhauben der Autos braten könnte.
497	deu	Er hat sein Wort gebrochen.
498	deu	Lieber für das gehasst werden, was man ist, als geliebt werden für das, was man nicht ist.
500	deu	Die Mathematik ist der Teil der Wissenschaft, den man weiter betreiben könnte, wenn man morgen aufwachen würde und entdecken würde, dass das Universum weg ist.
501	deu	Meine Augen sind ein Ozean, in dem sich meine Träume spiegeln.
503	deu	Schau mich an, wenn ich mit dir rede!
504	deu	Was wäre die Welt ohne Frauen?
505	deu	Was wäre, wenn du eine Rede halten würdest, und niemand käme?
506	deu	Ich weiß nicht, was ich sagen soll, um dich zu trösten.
507	deu	Er ist nicht mein Typ.
516	deu	Und was werden wir machen?
518	deu	Wo kann man telefonieren?
521	deu	Wie geht's dir? Hattest du eine gute Reise?
527	deu	Hauen wir ab von hier, die Bullen kommen.
532	deu	Das ist ein totales Schlamassel und es geht mir auf die Nerven.
537	deu	Eine halbe Million Kinder im Niger leidet immer noch an Unterernährung.
538	deu	Es wird fünf bis zehn Jahre dauern, bis die Technologie bereit ist.
548	deu	Wenn Sie etwas nicht verstehen, dann, weil Sie sich nicht des Kontextes bewusst sind.
550	deu	Die Schlüsselfrage ist nicht, was ich gewinnen kann, sondern, was ich verlieren kann.
551	deu	Alles, was falsch verstanden werden kann, wird falsch verstanden werden.
553	deu	Warum ist das Leben so voll mit Leiden?
554	deu	Trotz der Wichtigkeit von Schlaf ist sein Zweck ein Rätsel.
555	deu	Was bedeutet es, im 21. Jahrhundert einen gebildeten Verstand zu haben?
557	deu	Der Zug aus Genf wird in den Bahnhof einfahren.
562	deu	Ich habe so viel Arbeit, dass ich eine Stunde länger bleibe.
567	deu	Ihr wisst nicht, wer ich bin.
570	deu	Ich ziehe mich aus.
574	deu	"In einem Wörterbuch wie diesem sollte es mindestens zwei Sätze mit ""Kühlschrank"" geben."
576	deu	Der Wind hat sich beruhigt.
578	deu	Ich will nicht um deine Hand anhalten!
583	deu	Rom ist nicht an einem Tage erbaut worden.
585	deu	"""Bist du fertig?"" ""Im Gegenteil, ich habe noch nicht einmal begonnen."""
586	deu	"""Guten Morgen"", sagte Tom mit einem Lächeln."
589	deu	Das war der schönste Tag in meinem Leben.
591	deu	Ich habe meine Entscheidung getroffen.
596	deu	Wir haben einen Papst.
597	deu	Ein Mathematiker ist ein Mensch, der einen ihm vorgetragenen Gedanken nicht nur sofort begreift, sondern auch erkennt, auf welchem Denkfehler er beruht.
598	deu	Das Ganze ist mehr als die Summe seiner Teile.
599	deu	Die Mathematik ist dem Verlangen nicht abträglich.
604	deu	Ein Experte ist jemand, der die schlimmsten Fehler kennt, die in seinem Gebiet gemacht werden können und weiß, wie man sie vermeidet.
605	deu	Mathe zu machen ist die einzige gesellschaftlich akzeptable Art, sich in der Öffentlichkeit selbstzubefriedigen.
606	deu	Es gibt 10 Arten von Menschen in der Welt: die, die das Binärsystem verstehen, und die, die es nicht verstehen.
610	deu	Im Alter von sechs Jahren hatte er gelernt, eine Schreibmaschine zu bedienen und er erklärte dem Lehrer, dass er nicht lernen müsste, mit der Hand zu schreiben.
614	deu	Stell dich dem Leben lächelnd!
617	deu	Ich bin außer mir vor Freude.
619	deu	Die Ferien sind jetzt vorbei.
625	deu	Wenn ich Leute frage, was sie in Bezug aufs Gymnasium am meisten bedauern, sagen fast alle das Gleiche: dass sie so viel Zeit verschwendet haben.
632	deu	Du bist mein Typ.
639	deu	Verdirb mir nicht mein Vergnügen nach der ganzen Mühe, die ich mir gemacht habe.
643	deu	Er will nicht, dass du ihm von deinem Sexualleben erzählst.
648	deu	Was hat dich dazu gebracht, deine Meinung zu ändern?
652	deu	Wenn man weiß, dass etwas Unangenehmes geschehen wird, dass man zum Beispiel zum Zahnarzt oder nach Frankreich gehen wird, dann ist das nicht gut.
653	deu	Tatsächlich ist ein halbes Auge sehr nützlich, denn mit einem halben Auge kann ein Tier die Hälfte von einem anderen Tier sehen, das es auffressen will, und ihm aus dem Weg gehen, und es wird selber das Tier fressen, das nur ein Drittel-Auge oder nur 49% eines Auges hat, weil dieses ihm nicht schnell genug aus dem Weg gehen wird, und das Tier, das aufgefressen wurde, wird keine Kinder bekommen, weil es tot ist.
655	deu	"Wenn man eine Augenbraue hochzieht, kann das bedeuten ""Ich habe Lust, mit dir Sex zu haben"", aber auch ""Ich finde, dass das, was du gerade gesagt hast, vollkommen idiotisch ist."""
657	deu	Ein Stundenplan ist ein Ausweis für die Zeit, nur, wenn man keinen Stundenplan hat, ist die Zeit nicht da.
660	deu	Ich bin im Krankenhaus. Ich wurde vom Blitz getroffen.
664	deu	Man heiratet nicht jemanden, mit dem man leben kann - man heiratet die Person, ohne die man nicht leben kann.
669	deu	Es erfordert Weisheit, um Weisheit zu verstehen: die Musik ist nichts, wenn das Publikum taub ist.
674	deu	Ich hatte vor, heute an den Strand zu gehen, aber dann fing es an zu regnen.
677	deu	Menschen, die lieben, zweifeln an nichts oder zweifeln an allem.
682	deu	Jede Meinung ist eine Mischung aus Wahrheit und Irrtum.
684	deu	Wenn zwei Menschen immer die gleiche Meinung haben, ist einer von ihnen überflüssig.
696	deu	Es ist einfacher, Leute im Internet anzubaggern als auf der Straße.
699	deu	Es ist praktisch, einen Laptop zu haben.
701	deu	Wie oft am Tag schaust du dich im Spiegel an?
712	deu	Mein kleiner Bruder sieht fern.
715	deu	Katja leugnete, dass sie eine Anarchistin war, indem sie behauptete, dass sie nur wünschte, Veränderung in unserer Regierung zu machen, nicht, sie zu zerstören.
718	deu	Wenn man ein Telegramm sendet, ist Kürze unerlässlich, weil einem jedes Wort berechnet wird.
720	deu	Trotz Trangs regelmäßigen Liebesbeteuerungen hat Spenser immer noch Angst, dass sie irgendwann aufhören wird, ihn zu lieben.
722	deu	Aaah!! Mein Computer ist kaputt!
726	deu	Meine Wahlunlust kommt von meiner Abneigung gegen Politik.
728	deu	Sarah war scharfsinnig genug, um zu merken, dass ihre Freunde versuchten, ihr einen Streich zu spielen.
732	deu	Ich habe große Angst, von denen verschmäht zu werden, für die ich Liebe und Zuneigung empfinde.
735	deu	Das Publikum klatschte den Schauspielern für ihre Leistung Beifall.
737	deu	Der Schüler entschloss sich dazu, seine Hausarbeit zu kürzen, indem er alle unnötigen Details strich.
742	deu	Wenn ich Migräne habe, vermindert Aspirin meine Beschwerden nicht.
743	deu	Spensers sarkastische und scherzhafte Bemerkungen werden oft als Zeichen von Doppelwertigkeit missinterpretiert und zu ernst genommen.
746	deu	Der Irakkrieg ist ein unberechenbares Thema der politischen Debatte; ein falsches Wort und ein Streit könnte sich entzünden.
747	deu	Mein nächster Türnachbar ist ein Virtuose, dessen Geschick am Klavier ihm einen Namen unter den Musikexperten eingebracht hat.
750	deu	Sogar Leute, die nicht an die katholische Kirche glauben, verehren den Papst als ein symbolisches Oberhaupt.
753	deu	Als sich das Flugzeug Turbulenzen näherte, bat der Pilot die Passagiere an Bord des Flugzeugs, ihre Sitzgurte zu schließen.
754	deu	Obwohl sein Aufenthalt in Europa kurzlebig war, fühlte Spenser, dass er vom Reisen mehr über Beziehungen mit anderen Menschen gelernt hatte, als er es im College getan hatte.
755	deu	Jason war ein wortkarges Individuum, daher war es immer eine echte Überraschung, wenn er etwas sagte.
756	deu	Der König war seiner Schmeichler, die ihn beständig anpriesen, müde, also schickte er sie weg.
771	deu	Als beide Mädchen John sagten, dass sie Gefühle für ihn hatten, wusste der nicht, mit welchem Mädchen er zusammen sein sollte.
772	deu	Sogar jetzt, viele Jahre nach dem Kalten Krieg, ist immer noch viel Verbitterung zwischen Russen und Deutschen, besonders in Gebieten, die einst von der Sowjetunion besetzt waren.
779	deu	Meine Eltern würden meinen Bruder verstoßen, wenn sie herausfänden, dass er schwul ist.
780	deu	Um zu verhindern, dass seine Originalidee kopiert würde, verlegte sich Henry auf Schweigsamkeit.
781	deu	Ich würde gerne meine vorhergehende Erklärung widerrufen.
782	deu	Um sein Publikum für sich zu gewinnen, griff der Redner auf die Anwendung rhetorischer Techniken zurück, die er in seinen Kommunikationskursen gelernt hatte.
787	deu	Nach der unheilverkündenden Äußerung des Doktors war es klar, dass er düstere Neuigkeiten für den Patienten hatte.
793	deu	Er war eine gütiger alter Mann, der sich freiwillig anbot, den Rasen seiner Nachbarn kostenlos zu mähen.
796	deu	Trickbetrüger machen sich die Leichtgläubigkeit unerfahrener Geldgeber zu Nutze und betrügen sie um ihr Geld.
797	deu	Ich kann nicht einen Schritt Salsa tanzen.
799	deu	Ich mag meine Arbeit sehr gerne.
800	deu	Ray war bereit, Gary's Geschichte zu bestätigen, aber die Polizei war noch immer nicht überzeugt, dass einer von beiden die Wahrheit erzählte.
804	deu	Obwohl er seine Haftstrafe im Gefängnis abgesessen hatte, verzieh die Öffentlichkeit dem Mörder sein Verbrechen nie ganz.
824	deu	Er wird mich nicht schlagen.
836	deu	Wir konnten den Sonnenuntergang vom Fenster aus sehen.
862	deu	"Die Polizei ist gut darin, zu verstehen, dass jemand meine Kreditkarte gestohlen hat und viel Geld abgehoben hat. Es ist viel schwieriger, ihnen beizubrigen, dass ""jemand mein magisches Schwert gestohlen"" hat."
868	deu	"Wie spricht man ""pronounce"" aus ?"
871	deu	Aus welchem Land kommst du?
894	deu	Sagst du gerade, dass mein Leben in Gefahr ist?
895	deu	Hast du eine Vorstellung davon, wie mein Leben aussieht?
911	deu	Sie dürfen Ihr Auto hier nicht parken.
939	deu	Welche berühmten Lieder hättet ihr gerne komponiert, und warum?
941	deu	Ich bin verrückt nach dir.
990	deu	Ich werde dir zeigen, dass man aus seiner Asche wiederauferstehen kann.
1034	deu	Welcher ist Ihr Koffer?
1084	deu	Das klingt interessant. Was hast du ihr erzählt?
1140	deu	Das Flugzeug wurde wegen Nebel nach München umgeleitet.
2482	spa	Tengo que irme a dormir.
2491	spa	No tengo palabras.
2492	spa	Esto no acabará nunca.
2493	spa	Simplemente no sé qué decir...
2496	spa	¿Es una foto reciente?
2498	spa	Por alguna razón, el micrófono no había funcionado hasta entonces.
2499	spa	Todo el mundo debe aprender por sí mismo al final.
2500	spa	La educación en este mundo me decepciona.
2501	spa	El aprendizaje no debe ser forzado, sino estimulado.
2502	spa	"Es una tarea difícil elegir qué está ""bien"" o ""mal"", pero has de hacerlo."
2503	spa	Eso no va a cambiar nada.
2505	spa	Gano 100 € al día.
2506	spa	Quizás me dé pronto por vencido y en lugar de eso me eche una siesta.
2507	spa	Eso es porque no quieres estar solo.
2508	spa	Eso no va a pasar.
2510	spa	Me voy a esforzar por no molestarte en tus estudios.
2513	spa	No te preocupes.
2515	spa	Los llamaré cuando regrese mañana.
2521	spa	No puedo vivir así.
2522	spa	Una vez quise ser astrofísico.
2523	spa	Nunca me gustó la biología.
2526	spa	Desafortunadamente es verdad.
2527	spa	Están muy ocupados peleándose entre ellos, como para preocuparse por los ideales comunes.
2530	spa	¡Esa es mi frase!
2533	spa	Entonces tenemos un problema...
2536	spa	No me sorprende.
2537	spa	Si yo pudiera ser así...
2538	spa	Por alguna razón, me siento más vivo por la noche.
2539	spa	Eso depende del contexto.
2541	spa	Es la cosa más estúpida que he dicho nunca.
2547	spa	Voy a pegarle un tiro.
2548	spa	No soy un pez de verdad, sólo soy un peluche.
2549	spa	¡Yo sólo lo digo!
2550	spa	Eso fue probablemente lo que influenció su decisión.
2551	spa	Siempre me he preguntado cómo será tener hermanos.
2552	spa	Esto es lo que yo habría dicho.
2554	spa	Eso es porque eres una chica.
2559	spa	Pensemos en lo peor que podría pasar.
2561	spa	Yo puedo ser antisocial, pero eso no significa que no hable con la gente.
2562	spa	Así ha sido siempre.
2563	spa	Creo que lo mejor es no ser maleducado.
2564	spa	Uno siempre puede encontrar tiempo.
2566	spa	Cuando yo estaba en el instituto me levantaba a las 6 todas las mañanas.
2567	spa	Cuando me desperté estaba triste.
2568	spa	Por fin está más o menos explicado.
2572	spa	Para hacer eso, tienes que arriesgarte.
2573	spa	Todas las personas que están solas, están solas porque tienen miedo de los demás.
2574	spa	¿Por qué lo preguntas?
2576	spa	No puedo decírselo ahora. Ya no es tan simple.
2577	spa	Soy una persona que tiene muchos defectos, pero esos defectos pueden ser corregidos fácilmente.
2580	spa	Quizás sea lo mismo para él.
2583	spa	No quiero perder mis ideas, aunque algunas de ellas sean un poco extremas.
2585	spa	Eso es intrigante.
2587	spa	Yo no tengo una cuenta en estos foros.
2594	spa	Tú simplemente huyes de los problemas de la vida.
2596	spa	Hay un problema que no ves.
2598	spa	A mi profesor de física no le importa si me salto las clases.
2600	spa	Odio cuando hay mucha gente.
2601	spa	Me tengo que ir a la cama.
2603	spa	No te preguntaré más por hoy.
2606	spa	La policía te hará encontrar las balas.
2607	spa	Gracias por explicarme por fin por qué la gente me toma por un idiota.
2608	spa	No era mi intención.
2609	spa	Gracias por tu explicación.
2611	spa	¿Qué ocurrió?
2613	spa	No sé qué quieres decir.
2614	spa	Mi ordenador tiene que ser útil para algo.
2615	spa	¿Querías hablarme de libertad?
2619	spa	Hay muchas palabras que no entiendo.
2622	spa	Necesito hacerte una pregunta tonta.
2625	spa	¿Se puede expresar de otra manera?
2627	spa	Encontré una solución, pero la encontré tan rápido que no puede ser la correcta.
2630	spa	Me gusta la luz de las velas.
2631	spa	¿Qué has respondido?
2633	spa	Es una lástima que yo no tenga que adelgazar.
2634	spa	¡¿Nunca tienes clases o qué?!
2636	spa	¿Dónde está el problema?
2639	spa	Te quiero.
2640	spa	Ya no te quiero.
2641	spa	Tengo curiosidad.
2648	spa	Ya no sé qué hacer.
2651	spa	Yo no quería que pasase esto.
2653	spa	Antes de que te des cuenta, saldrás en los periódicos.
2654	spa	¿Qué otras opciones tengo?
2656	spa	No tengo nada mejor que hacer.
2657	spa	Tampoco lo puedo explicar.
2660	spa	Eso sólo muestra que no eres un robot.
2664	spa	No sé si todavía lo tengo.
2665	spa	¿Qué piensas que estaba haciendo?
2666	spa	No subestimes mi poder.
2667	spa	Mi mamá no habla muy bien inglés.
2668	spa	¡No hablo francés lo suficientemente bien!
2669	spa	Me estaba preguntando si vendrías hoy.
2670	spa	Ahí radica el problema.
2671	spa	¿Cómo encuentras comida en el espacio?
2676	spa	Cualquier cosa que hago, ella dice que puedo hacerlo mejor.
2678	spa	Te sorprendería lo que puedes aprender en una semana.
2679	spa	No tengo a nadie que viaje conmigo.
2680	spa	La vida es dura, pero yo soy más duro.
2686	spa	Es un juego de palabras.
2688	spa	Aprendí a vivir sin ella.
2690	spa	Tengo demasiadas cosas en la cabeza estos días.
2694	spa	Supongo que detrás de cada cosa que tenemos que hacer, hay algo que queremos hacer...
2696	spa	¡No esperes que los demás piensen por ti!
2697	spa	¡Nunca tienes tiempo para las cosas importantes!
2700	spa	Soy tan tonto... estoy intentando explicarte cosas que no entiendo ni yo.
2704	spa	¡No puede ser!
2706	spa	"""¿Quién es?"" ""Es tu madre."""
2709	spa	"""¿Qué habrá en la cueva? Tengo curiosidad."" ""No tengo ni idea."""
2713	spa	—¡Esto es lo que estaba buscando! —exclamó él.
2714	spa	—Esto parece muy interesante —dice Hiroshi.
2715	spa	"""El teléfono está sonando."" ""Yo lo cogeré."""
2719	spa	Por favor, no llores.
2720	spa	Hazme saber si hay algo que yo pueda hacer.
2721	spa	Depende de ti decidir si vamos allí o no.
2723	spa	Quiero un barco que me lleve lejos de aquí.
2725	spa	Un japonés nunca haría tal cosa.
2726	spa	Allen es un poeta.
2727	spa	El arquero mató al ciervo.
2728	spa	Si ves un error, entonces corrígelo, por favor.
2730	spa	Si no comes, te mueres.
2731	spa	"¿Cómo se escribe ""pretty""?"
2732	spa	¿Por qué no nos vamos a casa?
2738	spa	He vivido más de un mes en Nagoya.
2742	spa	Cuando empieces a parecerte a la foto de tu pasaporte deberías irte de vacaciones.
2745	spa	Naturalmente, con tanta gente a su alrededor se puso un poco nervioso.
2746	spa	Al salir de la estación vi a un hombre.
2747	spa	¿Y nadie le ayudó?
2750	spa	Bueno, la noche es muy larga, ¿no?
2751	spa	Has tenido suerte de que no te haya mordido.
2756	spa	Por favor, ¿dónde están los huevos?
2762	spa	Se quedaron con la boca abierta.
2774	spa	No es pobre quien tiene muy poco, sino quien ansía demasiado.
2776	spa	¿Cuánto tiempo se tarda en llegar a la estación?
2783	spa	No quiero pasarme el resto de mi vida arrepintiéndome de ello.
2789	spa	Nada se consigue sin esfuerzo.
2792	spa	Creo que los exámenes están arruinando la educación.
2796	spa	Haz lo que te diga.
2798	spa	Ya son las once.
2799	spa	¿Puedo hablar con la Sra. Brown?
2805	spa	París es la ciudad más bonita del mundo.
2806	spa	¡Eh! Puede que no tenga dinero, pero todavía tengo mi orgullo.
2808	spa	Esta es mi amiga Rachel, fuimos al instituto juntos.
2812	spa	No cabe duda de que el universo es infinito.
2813	spa	Para ser perfecta sólo le faltaba un defecto.
2825	spa	¿Cómo se dice eso en italiano?
2826	spa	¿Está lejos de aquí?
2827	spa	¡Estas cosas no son mías!
2828	spa	Gracias, es todo.
2833	spa	Italia es un país muy bonito.
2838	spa	¿Dónde están las duchas?
2841	spa	He perdido mi monedero.
2844	spa	La vida es lo que te pasa mientras estás ocupado haciendo otros planes.
2849	spa	"""Pásame la sal, por favor."" ""Aquí tienes."""
2850	spa	¡Hay demasiadas cosas que hacer!
2852	spa	Vamos, juega conmigo, ¡estoy tan aburrido!
2861	spa	Él ha roto su palabra.
2865	spa	¡Mírame cuando te hablo!
2867	spa	No sé qué decir para consolarte.
2868	spa	No es mi tipo.
2876	spa	La cuenta, por favor.
2881	spa	Esta noche nos vamos a la iglesia.
2886	spa	Se está haciendo la dormida, por eso no ronca.
2899	spa	Me gustaría darle un regalo por su cumpleaños.
2904	spa	Estoy casada y tengo dos niños.
2905	spa	Él toca el piano muy bien.
2909	spa	¿Por qué la gente va al cine?
2917	spa	Las matemáticas son como la lógica de la física.
2918	spa	Hay 10 tipos de personas en el mundo: las que entienden binario y las que no.
2923	spa	¡Afronta la vida con una sonrisa!
2930	spa	¿No le has dicho nada?
2933	spa	¿Me podrías llamar más tarde por favor?
2934	spa	¿Con quién hablo?
2940	spa	Estaba releyendo las cartas que me enviaste.
2957	spa	Estoy casi listo.
2959	spa	La vida empieza cuando te das cuenta de quién eres realmente.
2960	spa	La vida empieza cuando decides lo que esperas de ella.
2971	spa	Quiero ser más independiente.
2975	spa	La esencia de la libertad son las matemáticas.
2982	spa	La belleza está en los ojos del que mira.
3001	spa	Si no lo hago ahora, nunca lo haré.
3002	spa	Hay muchas cosas que no sabes sobre mi personalidad.
3004	spa	Todo el mundo se merece una segunda oportunidad.
3005	spa	¿Cuál es la ventaja de esta tecnología?
3008	spa	Cuando hablas con los demás, lo haces con los brazos cruzados.
3012	spa	La creatividad es un aspecto importante para el desarrollo del ser humano.
3015	spa	No hay que preparar un plato diferente para cada persona.
3017	spa	Prefiero buscarle solución a los problemas, no sólo denunciarlos.
3021	spa	Todo lo que necesito saber sobre la vida, lo aprendí de un muñeco de nieve.
3024	spa	Las despedidas siempre son tristes.
3036	spa	No me gustan estas tazas, las de la mesa me gustan más.
3037	spa	¿Tiene experiencia profesional?
3040	spa	¿Cuánto se da de propina en España?
3041	spa	¿Quién ha pintado este cuadro?
3055	spa	Lavar, cortar y secar, por favor.
3058	spa	Todas las mañanas y todas las noches le doy de comer a mi gato.
3059	spa	¿Podría repetirlo, por favor?
3060	spa	¿Generalmente quién visita más a sus padres, los hijos o las hijas?
3061	spa	Todo esfuerzo merece una recompensa.
3064	spa	¿Por qué costó tanto establecer que la neurona era la unidad básica del tejido nervioso?
